{
    "$schema": "http://json-schema.org/draft-04/schema#",
    "type": "object",
    "properties": {
        "errors": {
            "type": "array",
            "items": {
                "type": "object",
                "properties": {
                    "message": {
                        "type": "string"
                    }
                }
            }
        },
        "message": {
            "type": "string"
        },
        "status": {
            "type": "number"
        },
        "data": {
            "type": "object",
            "properties": {
                "name": {
                    "type": "string"
                },
                "levels": {
                    "type": "array",
                    "items": {
                        "type": "object",
                        "properties": {
                            "name": {
                                "type": "string"
                            },
                            "related": {
                                "type": "array",
                                "items": {
                                    "type": "string"
                                }
                            }
                        }
                    }
                },
                "functions": {
                    "type": "array",
                    "items": {
                        "type": "object",
                        "properties": {
                            "name": {
                                "type": "string"
                            },
                            "related": {
                                "type": "array",
                                "items": {
                                    "type": "object",
                                    "properties": {
                                        "name": {
                                            "type": "string"
                                        },
                                        "rank": {
                                            "type": "number"                                        }
                                    }
                                }
                            }
                        }
                    }
                }
            }
        }
    }
}
